{"id":"scienze_ingresso_classe_quarta","title":"Verifica d'ingresso di Scienze - Classe quarta","description":"Verifica delle conoscenze fondamentali di scienze della classe terza primaria.","mode":"quiz","settings":{"collectEmails":false,"limitOneResponse":false,"shuffleQuestions":false},"pages":[{"id":"p1","title":"I viventi e i non viventi","questions":[{"id":"q1","type":"multiple_choice","title":"Quale tra questi è un essere vivente?","required":true,"options":["Un sasso","Un albero","Un bicchiere","Una matita"],"correctAnswer":"Un albero","score":1,"metadata":{"topic":"Viventi e non viventi","difficulty":"easy"}},{"id":"q2","type":"multiple_choice","title":"Che cosa hanno in comune tutti gli esseri viventi?","required":true,"options":["Nascono, crescono e si riproducono","Si muovono tutti nello stesso modo","Hanno tutti le zampe","Vivono tutti sulla terraferma"],"correctAnswer":"Nascono, crescono e si riproducono","score":1,"metadata":{"topic":"Viventi e non viventi","difficulty":"medium"}},{"id":"q3","type":"multiple_choice","title":"Di che cosa ha bisogno un essere vivente?","required":true,"options":["Cibo, acqua e aria","Solo acqua","Solo luce","Solo aria"],"correctAnswer":"Cibo, acqua e aria","score":1,"metadata":{"topic":"Viventi e non viventi","difficulty":"easy"}},{"id":"q4","type":"true_false","title":"Una pianta è un essere vivente.","required":true,"options":["Vero","Falso"],"correctAnswer":"Vero","score":1,"metadata":{"topic":"Viventi e non viventi","difficulty":"easy"}},{"id":"q5","type":"true_false","title":"Tutti gli esseri viventi possono vivere senza acqua.","required":true,"options":["Vero","Falso"],"correctAnswer":"Falso","score":1,"metadata":{"topic":"Viventi e non viventi","difficulty":"easy"}}]},{"id":"p2","title":"Le piante","questions":[{"id":"q6","type":"multiple_choice","title":"Quale parte della pianta assorbe acqua e sali minerali dal terreno?","required":true,"options":["Il fiore","La foglia","La radice","Il frutto"],"correctAnswer":"La radice","score":1,"metadata":{"topic":"Piante","difficulty":"easy"}},{"id":"q7","type":"multiple_choice","title":"Qual è principalmente la funzione delle foglie?","required":true,"options":["Assorbire acqua dal terreno","Permettere alla pianta di produrre il proprio nutrimento","Tenere ferma la pianta nel terreno","Proteggere i semi"],"correctAnswer":"Permettere alla pianta di produrre il proprio nutrimento","score":1,"metadata":{"topic":"Piante","difficulty":"medium"}},{"id":"q8","type":"multiple_choice","title":"Quale parte della pianta sostiene foglie e fiori?","required":true,"options":["La radice","Il fusto","Il seme","Il frutto"],"correctAnswer":"Il fusto","score":1,"metadata":{"topic":"Piante","difficulty":"easy"}},{"id":"q9","type":"true_false","title":"Le piante hanno bisogno della luce per vivere e produrre il proprio nutrimento.","required":true,"options":["Vero","Falso"],"correctAnswer":"Vero","score":1,"metadata":{"topic":"Piante","difficulty":"medium"}},{"id":"q10","type":"true_false","title":"Tutte le piante hanno fiori.","required":true,"options":["Vero","Falso"],"correctAnswer":"Falso","score":1,"metadata":{"topic":"Piante","difficulty":"medium"}}]},{"id":"p3","title":"Gli animali","questions":[{"id":"q11","type":"multiple_choice","title":"Quale animale è un mammifero?","required":true,"options":["Il cane","La trota","La lucertola","La farfalla"],"correctAnswer":"Il cane","score":1,"metadata":{"topic":"Animali","difficulty":"easy"}},{"id":"q12","type":"multiple_choice","title":"Quale animale depone le uova?","required":true,"options":["Il gatto","Il cavallo","La gallina","Il delfino"],"correctAnswer":"La gallina","score":1,"metadata":{"topic":"Animali","difficulty":"easy"}},{"id":"q13","type":"multiple_choice","title":"Gli animali erbivori si nutrono principalmente di:","required":true,"options":["Altri animali","Piante","Sassi","Acqua"],"correctAnswer":"Piante","score":1,"metadata":{"topic":"Animali","difficulty":"easy"}},{"id":"q14","type":"true_false","title":"I pesci respirano attraverso le branchie.","required":true,"options":["Vero","Falso"],"correctAnswer":"Vero","score":1,"metadata":{"topic":"Animali","difficulty":"easy"}},{"id":"q15","type":"true_false","title":"Tutti gli animali hanno quattro zampe.","required":true,"options":["Vero","Falso"],"correctAnswer":"Falso","score":1,"metadata":{"topic":"Animali","difficulty":"easy"}}]},{"id":"p4","title":"Il corpo umano e i cinque sensi","questions":[{"id":"q16","type":"multiple_choice","title":"Quale organo utilizziamo principalmente per vedere?","required":true,"options":["Il naso","L'orecchio","L'occhio","La lingua"],"correctAnswer":"L'occhio","score":1,"metadata":{"topic":"Corpo umano e cinque sensi","difficulty":"easy"}},{"id":"q17","type":"multiple_choice","title":"Quale senso ci permette di riconoscere i suoni?","required":true,"options":["Vista","Udito","Olfatto","Tatto"],"correctAnswer":"Udito","score":1,"metadata":{"topic":"Corpo umano e cinque sensi","difficulty":"easy"}},{"id":"q18","type":"multiple_choice","title":"Quale parte del corpo utilizziamo principalmente per percepire caldo, freddo e dolore?","required":true,"options":["La pelle","I capelli","I denti","Le ossa"],"correctAnswer":"La pelle","score":1,"metadata":{"topic":"Corpo umano e cinque sensi","difficulty":"easy"}},{"id":"q19","type":"true_false","title":"La lingua ci permette di percepire alcuni sapori.","required":true,"options":["Vero","Falso"],"correctAnswer":"Vero","score":1,"metadata":{"topic":"Corpo umano e cinque sensi","difficulty":"easy"}},{"id":"q20","type":"true_false","title":"Il naso serve soltanto per respirare e non ci permette di percepire gli odori.","required":true,"options":["Vero","Falso"],"correctAnswer":"Falso","score":1,"metadata":{"topic":"Corpo umano e cinque sensi","difficulty":"easy"}}]},{"id":"p5","title":"L'acqua","questions":[{"id":"q21","type":"multiple_choice","title":"Quali sono i tre principali stati dell'acqua?","required":true,"options":["Duro, morbido e liquido","Solido, liquido e gassoso","Freddo, caldo e tiepido","Trasparente, bianco e blu"],"correctAnswer":"Solido, liquido e gassoso","score":1,"metadata":{"topic":"Acqua","difficulty":"easy"}},{"id":"q22","type":"multiple_choice","title":"Quando l'acqua viene messa nel congelatore, diventa:","required":true,"options":["Vapore","Ghiaccio","Aria","Neve sempre"],"correctAnswer":"Ghiaccio","score":1,"metadata":{"topic":"Acqua","difficulty":"easy"}},{"id":"q23","type":"multiple_choice","title":"Quando l'acqua viene riscaldata molto, può trasformarsi in:","required":true,"options":["Vapore acqueo","Ghiaccio","Terra","Sabbia"],"correctAnswer":"Vapore acqueo","score":1,"metadata":{"topic":"Acqua","difficulty":"easy"}},{"id":"q24","type":"true_false","title":"L'acqua può passare dallo stato liquido a quello solido.","required":true,"options":["Vero","Falso"],"correctAnswer":"Vero","score":1,"metadata":{"topic":"Acqua","difficulty":"easy"}},{"id":"q25","type":"true_false","title":"Il vapore acqueo è acqua allo stato gassoso.","required":true,"options":["Vero","Falso"],"correctAnswer":"Vero","score":1,"metadata":{"topic":"Acqua","difficulty":"medium"}}]},{"id":"p6","title":"La materia e i materiali","questions":[{"id":"q26","type":"multiple_choice","title":"Quale di questi è un materiale naturale?","required":true,"options":["Plastica","Vetro","Legno","Nylon"],"correctAnswer":"Legno","score":1,"metadata":{"topic":"Materia e materiali","difficulty":"easy"}},{"id":"q27","type":"multiple_choice","title":"Quale oggetto è generalmente trasparente?","required":true,"options":["Un vetro pulito","Un pezzo di legno","Un sasso","Un cartone spesso"],"correctAnswer":"Un vetro pulito","score":1,"metadata":{"topic":"Materia e materiali","difficulty":"easy"}},{"id":"q28","type":"multiple_choice","title":"Quale materiale è particolarmente adatto per costruire una pentola?","required":true,"options":["Carta","Metallo","Stoffa","Cartone"],"correctAnswer":"Metallo","score":1,"metadata":{"topic":"Materia e materiali","difficulty":"easy"}},{"id":"q29","type":"true_false","title":"La materia occupa uno spazio.","required":true,"options":["Vero","Falso"],"correctAnswer":"Vero","score":1,"metadata":{"topic":"Materia e materiali","difficulty":"medium"}},{"id":"q30","type":"true_false","title":"Tutti i materiali hanno le stesse caratteristiche.","required":true,"options":["Vero","Falso"],"correctAnswer":"Falso","score":1,"metadata":{"topic":"Materia e materiali","difficulty":"easy"}}]},{"id":"p7","title":"L'ambiente e gli ecosistemi","questions":[{"id":"q31","type":"multiple_choice","title":"Che cos'è un habitat?","required":true,"options":["Il cibo di un animale","Il luogo in cui vive un essere vivente","Il verso di un animale","Il corpo di una pianta"],"correctAnswer":"Il luogo in cui vive un essere vivente","score":1,"metadata":{"topic":"Ambiente ed ecosistemi","difficulty":"medium"}},{"id":"q32","type":"multiple_choice","title":"In un ambiente naturale, gli animali e le piante:","required":true,"options":["Vivono completamente separati","Possono avere relazioni tra loro e con l'ambiente","Non hanno bisogno dell'acqua","Non hanno bisogno di nutrirsi"],"correctAnswer":"Possono avere relazioni tra loro e con l'ambiente","score":1,"metadata":{"topic":"Ambiente ed ecosistemi","difficulty":"medium"}},{"id":"q33","type":"multiple_choice","title":"Quale comportamento aiuta a proteggere l'ambiente?","required":true,"options":["Lasciare i rifiuti nel bosco","Sprecare l'acqua","Fare la raccolta differenziata","Gettare la plastica nei fiumi"],"correctAnswer":"Fare la raccolta differenziata","score":1,"metadata":{"topic":"Ambiente ed ecosistemi","difficulty":"easy"}},{"id":"q34","type":"true_false","title":"Gli esseri viventi dipendono anche dall'ambiente in cui vivono.","required":true,"options":["Vero","Falso"],"correctAnswer":"Vero","score":1,"metadata":{"topic":"Ambiente ed ecosistemi","difficulty":"medium"}},{"id":"q35","type":"true_false","title":"I